{
  "checks": [
    {
      "check_id": "WVH-01",
      "check_version": "1.0.0",
      "invalidation_dependencies": [
        "product-sources",
        "accepted-specification",
        "runner",
        "check-inventory",
        "toolchain"
      ],
      "output_schema": "wirevpn.infrastructure-result/1.0",
      "phase": "W1",
      "requirement": "required",
      "runner": {
        "digest": {
          "algorithm": "sha-256",
          "sha256": "061eacaec7ba6b99dd89921973e27259922c1365064de769a8b4e6636ef0837a",
          "state": "content-bound"
        },
        "path": "tests/harness/run.py",
        "version": "wirevpn.python-runner/1.0"
      },
      "suite": "source-manifest",
      "toolchain": {
        "digest": {
          "algorithm": "sha-256",
          "sha256": "3c7e0fb5898342b0f3ad9b16a28af61ed873b1537187407e9d3e79e20e914d79",
          "state": "content-bound"
        },
        "identity": "wirevpn-w1-toolchain",
        "path": "tests/toolchain.json",
        "version": "wirevpn.toolchain/1.0"
      },
      "vectors": {
        "digest": {
          "algorithm": "sha-256",
          "sha256": "bf54e3aa2d4eff4f80d067035e81761a01bf5e3449fe1507c8923bc35e101e58",
          "state": "content-bound"
        },
        "path": "tests/vectors/vectors.json",
        "selection": {
          "acceptance_id": "WVH-01",
          "mode": "runner-self-test"
        },
        "version": "wirevpn.semantic-vectors/1.0"
      }
    },
    {
      "check_id": "WVH-02",
      "check_version": "1.0.0",
      "invalidation_dependencies": [
        "runner",
        "check-inventory",
        "fixtures",
        "public-report-policy"
      ],
      "output_schema": "wirevpn.infrastructure-result/1.0",
      "phase": "W1",
      "requirement": "required",
      "runner": {
        "digest": {
          "algorithm": "sha-256",
          "sha256": "061eacaec7ba6b99dd89921973e27259922c1365064de769a8b4e6636ef0837a",
          "state": "content-bound"
        },
        "path": "tests/harness/run.py",
        "version": "wirevpn.python-runner/1.0"
      },
      "suite": "path-policy-negative",
      "toolchain": {
        "digest": {
          "algorithm": "sha-256",
          "sha256": "3c7e0fb5898342b0f3ad9b16a28af61ed873b1537187407e9d3e79e20e914d79",
          "state": "content-bound"
        },
        "identity": "wirevpn-w1-toolchain",
        "path": "tests/toolchain.json",
        "version": "wirevpn.toolchain/1.0"
      },
      "vectors": {
        "digest": {
          "algorithm": "sha-256",
          "sha256": "bf54e3aa2d4eff4f80d067035e81761a01bf5e3449fe1507c8923bc35e101e58",
          "state": "content-bound"
        },
        "path": "tests/vectors/vectors.json",
        "selection": {
          "acceptance_id": "WVH-02",
          "mode": "runner-self-test"
        },
        "version": "wirevpn.semantic-vectors/1.0"
      }
    },
    {
      "check_id": "WVH-03",
      "check_version": "1.0.0",
      "invalidation_dependencies": [
        "runner",
        "check-inventory",
        "fake-model",
        "fixtures"
      ],
      "output_schema": "wirevpn.infrastructure-result/1.0",
      "phase": "W1",
      "requirement": "required",
      "runner": {
        "digest": {
          "algorithm": "sha-256",
          "sha256": "061eacaec7ba6b99dd89921973e27259922c1365064de769a8b4e6636ef0837a",
          "state": "content-bound"
        },
        "path": "tests/harness/run.py",
        "version": "wirevpn.python-runner/1.0"
      },
      "suite": "fake-command-negative",
      "toolchain": {
        "digest": {
          "algorithm": "sha-256",
          "sha256": "3c7e0fb5898342b0f3ad9b16a28af61ed873b1537187407e9d3e79e20e914d79",
          "state": "content-bound"
        },
        "identity": "wirevpn-w1-toolchain",
        "path": "tests/toolchain.json",
        "version": "wirevpn.toolchain/1.0"
      },
      "vectors": {
        "digest": {
          "algorithm": "sha-256",
          "sha256": "bf54e3aa2d4eff4f80d067035e81761a01bf5e3449fe1507c8923bc35e101e58",
          "state": "content-bound"
        },
        "path": "tests/vectors/vectors.json",
        "selection": {
          "acceptance_id": "WVH-03",
          "mode": "runner-self-test"
        },
        "version": "wirevpn.semantic-vectors/1.0"
      }
    },
    {
      "check_id": "WVH-04",
      "check_version": "1.0.0",
      "invalidation_dependencies": [
        "product-sources",
        "runner",
        "check-inventory"
      ],
      "output_schema": "wirevpn.infrastructure-result/1.0",
      "phase": "W1",
      "requirement": "required",
      "runner": {
        "digest": {
          "algorithm": "sha-256",
          "sha256": "061eacaec7ba6b99dd89921973e27259922c1365064de769a8b4e6636ef0837a",
          "state": "content-bound"
        },
        "path": "tests/harness/run.py",
        "version": "wirevpn.python-runner/1.0"
      },
      "suite": "embedded-payload-static",
      "toolchain": {
        "digest": {
          "algorithm": "sha-256",
          "sha256": "3c7e0fb5898342b0f3ad9b16a28af61ed873b1537187407e9d3e79e20e914d79",
          "state": "content-bound"
        },
        "identity": "wirevpn-w1-toolchain",
        "path": "tests/toolchain.json",
        "version": "wirevpn.toolchain/1.0"
      },
      "vectors": {
        "digest": {
          "algorithm": "sha-256",
          "sha256": "bf54e3aa2d4eff4f80d067035e81761a01bf5e3449fe1507c8923bc35e101e58",
          "state": "content-bound"
        },
        "path": "tests/vectors/vectors.json",
        "selection": {
          "acceptance_id": "WVH-04",
          "mode": "runner-self-test"
        },
        "version": "wirevpn.semantic-vectors/1.0"
      }
    },
    {
      "check_id": "WVH-05",
      "check_version": "1.0.0",
      "invalidation_dependencies": [
        "runner",
        "vector-schema",
        "vector-bundle",
        "check-inventory"
      ],
      "output_schema": "wirevpn.infrastructure-result/1.0",
      "phase": "W1",
      "requirement": "required",
      "runner": {
        "digest": {
          "algorithm": "sha-256",
          "sha256": "061eacaec7ba6b99dd89921973e27259922c1365064de769a8b4e6636ef0837a",
          "state": "content-bound"
        },
        "path": "tests/harness/run.py",
        "version": "wirevpn.python-runner/1.0"
      },
      "suite": "vector-schema-negative",
      "toolchain": {
        "digest": {
          "algorithm": "sha-256",
          "sha256": "3c7e0fb5898342b0f3ad9b16a28af61ed873b1537187407e9d3e79e20e914d79",
          "state": "content-bound"
        },
        "identity": "wirevpn-w1-toolchain",
        "path": "tests/toolchain.json",
        "version": "wirevpn.toolchain/1.0"
      },
      "vectors": {
        "digest": {
          "algorithm": "sha-256",
          "sha256": "bf54e3aa2d4eff4f80d067035e81761a01bf5e3449fe1507c8923bc35e101e58",
          "state": "content-bound"
        },
        "path": "tests/vectors/vectors.json",
        "selection": {
          "acceptance_id": "WVH-05",
          "mode": "runner-self-test"
        },
        "version": "wirevpn.semantic-vectors/1.0"
      }
    },
    {
      "check_id": "WVH-06",
      "check_version": "1.0.0",
      "invalidation_dependencies": [
        "product-sources",
        "runner",
        "instrumentation-profile",
        "check-inventory"
      ],
      "output_schema": "wirevpn.infrastructure-result/1.0",
      "phase": "W1",
      "requirement": "required",
      "runner": {
        "digest": {
          "algorithm": "sha-256",
          "sha256": "061eacaec7ba6b99dd89921973e27259922c1365064de769a8b4e6636ef0837a",
          "state": "content-bound"
        },
        "path": "tests/harness/run.py",
        "version": "wirevpn.python-runner/1.0"
      },
      "suite": "instrumentation",
      "toolchain": {
        "digest": {
          "algorithm": "sha-256",
          "sha256": "3c7e0fb5898342b0f3ad9b16a28af61ed873b1537187407e9d3e79e20e914d79",
          "state": "content-bound"
        },
        "identity": "wirevpn-w1-toolchain",
        "path": "tests/toolchain.json",
        "version": "wirevpn.toolchain/1.0"
      },
      "vectors": {
        "digest": {
          "algorithm": "sha-256",
          "sha256": "bf54e3aa2d4eff4f80d067035e81761a01bf5e3449fe1507c8923bc35e101e58",
          "state": "content-bound"
        },
        "path": "tests/vectors/vectors.json",
        "selection": {
          "acceptance_id": "WVH-06",
          "mode": "runner-self-test"
        },
        "version": "wirevpn.semantic-vectors/1.0"
      }
    },
    {
      "check_id": "WVH-07",
      "check_version": "1.0.0",
      "invalidation_dependencies": [
        "runner",
        "check-inventory",
        "fixtures",
        "public-report-policy"
      ],
      "output_schema": "wirevpn.infrastructure-result/1.0",
      "phase": "W1",
      "requirement": "required",
      "runner": {
        "digest": {
          "algorithm": "sha-256",
          "sha256": "061eacaec7ba6b99dd89921973e27259922c1365064de769a8b4e6636ef0837a",
          "state": "content-bound"
        },
        "path": "tests/harness/run.py",
        "version": "wirevpn.python-runner/1.0"
      },
      "suite": "evidence-integrity",
      "toolchain": {
        "digest": {
          "algorithm": "sha-256",
          "sha256": "3c7e0fb5898342b0f3ad9b16a28af61ed873b1537187407e9d3e79e20e914d79",
          "state": "content-bound"
        },
        "identity": "wirevpn-w1-toolchain",
        "path": "tests/toolchain.json",
        "version": "wirevpn.toolchain/1.0"
      },
      "vectors": {
        "digest": {
          "algorithm": "sha-256",
          "sha256": "bf54e3aa2d4eff4f80d067035e81761a01bf5e3449fe1507c8923bc35e101e58",
          "state": "content-bound"
        },
        "path": "tests/vectors/vectors.json",
        "selection": {
          "acceptance_id": "WVH-07",
          "mode": "runner-self-test"
        },